<?xml version="1.0" encoding="UTF-8"?>
<?xml-stylesheet type="text/xsl" href="style.xsl"?>
<document xmlns:xsi="http://www.w3.org/2001/XMLSchema-instance"
          xsi:noNamespaceSchemaLocation="schema.xsd">
    <container>
        <box1>
            <header>
                <box2>
                    <profile>
                        <image src="giv.avif" alt="logo"/>
                        <menu>
                            <item>Home</item>
                            <item>About</item>
                            <item>Resource Person</item>
                            <item>Login</item>
                        </menu>
                    </profile>
                </box2>
                <b2>
                    <headline>Let's build the ultimate carrier together!</headline>
                </b2>
            </header>
        </box1>

        <sections>
            <section id="section1">
                <title>Specific</title>
                <description>Latest technology taught with low cost/free</description>
            </section>
            <section id="section2">
                <title>Workshop</title>
                <description>This provides ultimate learning &amp; Experience</description>
            </section>
            <section id="section3">
                <title>Support</title>
                <description>We have your back with our best in class support Team</description>
            </section>
            <section id="section4">
                <title>Experience</title>
                <description>10+ years of Experienced mentor help to learn from workshop</description>
            </section>
        </sections>

        <mission>
            <headline>Our mission is to equip professionals to fulfill the Great knowledge</headline>
            <description>Join us for an enriching workshop designed to empower professionals with the
                essential knowledge and skills needed to excel in their careers, ensuring you are well-equipped to
                make informed decisions, solve problems effectively, and drive success within your organization.
            </description>
        </mission>

        <footer>
            <contact-info>Contact info: Visit our webpage for more details.</contact-info>
            <link>Return to top</link>
        </footer>
    </container>
</document>